{
  "bundle_id": "bundle-wf-invoice-reconcile-01-2026-07-23",
  "run_id": "run-9f1c2b",
  "workflow_manifest_digest": "sha256:cf34ecd7b8eeff090b776cb06ab3742e15e4b739e7f6eac14d7fb02d2999c5b7",
  "entries": [
    { "kind": "connector_attestation", "digest": "sha256:af2c0d0db5baec3e06592c51e073a7606955a005fe70bbbce5c0f85c08fe2f0b", "trust_label": "connector_asserted" },
    { "kind": "execution_state", "digest": "sha256:2ca2ac613d4d7c2aab7190dcb452b1b4efe3994cdae36d67b69986f43e3866fb", "trust_label": "kernel_verified" }
  ],
  "checkpoints_ref": ["sha256:d78dff200aa19cf0f138bf54c8c88cb4f5bf3982b3b473aaf5bfa0c016fcf221"],
  "anchors_ref": ["freetsa.org", "calendar.opentimestamps.org"],
  "redaction_profile": "default-v1"
}
